{
  "space_id": "ks_agent_finance",
  "source_id": "src_repo_meta_claw",
  "source_type": "git_repository",
  "location": "/Users/kai/IdeaProjects/meta_claw",
  "display_name": "meta_claw",
  "status": "new_source",
  "description": "Sample repository registration for Sprint 1.",
  "workspace_identity": {
    "workspace_id": "ws_meta_claw",
    "workspace_root": "/Users/kai/IdeaProjects/meta_claw",
    "vcs": "git",
    "origin_mode": "native_git",
    "remote_url": "git@github.com:org/meta_claw.git",
    "default_branch": "main"
  },
  "snapshot_hint": {
    "branch": "main",
    "head_commit": "abc123",
    "worktree_state": "dirty"
  },
  "created_at": "2026-04-21T09:00:00Z",
  "updated_at": "2026-04-21T09:00:00Z"
}
